{
  "$schema": "https://json-schema.org/draft/2020-12/schema",
  "$id": "https://mestre-yoda.dev/schemas/state/event/v1",
  "title": "Mestre Yoda append-only event v1",
  "type": "object",
  "additionalProperties": false,
  "required": [
    "contractVersion",
    "stateContract",
    "eventId",
    "eventType",
    "occurredAt",
    "operation",
    "policyVersion",
    "priorRevision",
    "resultingRevision",
    "reasonCode",
    "effect",
    "artifactRefs",
    "evidenceRefs",
    "observedIdentity",
    "previousHash",
    "eventHash"
  ],
  "properties": {
    "contractVersion": { "const": "1.0.0" },
    "stateContract": { "const": "1.0.0" },
    "eventId": { "$ref": "#/$defs/id" },
    "eventType": {
      "enum": ["operation", "decision", "transition", "recovery"]
    },
    "occurredAt": { "$ref": "#/$defs/timestamp" },
    "operation": { "$ref": "#/$defs/id" },
    "policyVersion": { "$ref": "#/$defs/id" },
    "priorRevision": { "type": "integer", "minimum": 0 },
    "resultingRevision": { "type": "integer", "minimum": 1 },
    "reasonCode": {
      "type": "string",
      "pattern": "^[a-z][a-z0-9_]*(?:\\.[a-z0-9_]+)*$"
    },
    "effect": { "enum": ["none", "state", "artifact", "state-and-artifact"] },
    "artifactRefs": {
      "type": "array",
      "items": { "$ref": "#/$defs/reference" },
      "uniqueItems": true
    },
    "evidenceRefs": {
      "type": "array",
      "items": { "$ref": "#/$defs/reference" },
      "uniqueItems": true
    },
    "observedIdentity": {
      "type": "object",
      "additionalProperties": false,
      "required": ["host", "model"],
      "properties": {
        "host": { "$ref": "#/$defs/id" },
        "model": { "oneOf": [{ "$ref": "#/$defs/id" }, { "type": "null" }] }
      }
    },
    "previousHash": {
      "oneOf": [{ "$ref": "#/$defs/sha256" }, { "type": "null" }]
    },
    "eventHash": { "$ref": "#/$defs/sha256" }
  },
  "$defs": {
    "id": {
      "type": "string",
      "pattern": "^[a-zA-Z0-9][a-zA-Z0-9._:-]{0,127}$"
    },
    "sha256": { "type": "string", "pattern": "^[a-f0-9]{64}$" },
    "timestamp": {
      "type": "string",
      "pattern": "^\\d{4}-\\d{2}-\\d{2}T\\d{2}:\\d{2}:\\d{2}(?:\\.\\d{1,9})?Z$"
    },
    "reference": {
      "type": "string",
      "minLength": 1,
      "maxLength": 1024,
      "pattern": "^(?!/)(?![A-Za-z]:[\\\\/])(?!\\\\\\\\)(?!.*(?:^|/)\\.\\.(?:/|$))(?![a-z][a-z0-9+.-]*://)[^\\u0000-\\u001f\\u007f]+$"
    }
  }
}
